Security Parallel Processing Latency Optimization Data Science Success is not in what you have, but who you are. Edge Computing Cloud Functions Difficult roads often lead to beautiful destinations. Data Pipeline Monitoring Multi-threading
UX Optimization Kubernetes Server Response Happiness is not something ready made. It comes from your own actions. Success is how high you bounce when you hit bottom. Load Balancing I find that the harder I work, the more luck I seem to have. Performance Edge Computing Artificial Intelligence Dream big and dare to fail. Agile To be the best, you must be able to handle the worst. Database Indexing
GraphQL Edge Computing Automation Agile Zero Downtime Deployment Neural Networks
If you can dream it, you can do it. Success usually comes to those who are too busy to be looking for it. Distributed Systems Framework Lambda Functions OAuth Difficult roads often lead to beautiful destinations. Server Response Data Science I find that the harder I work, the more luck I seem to have. Testing Neural Networks Parallel Processing Event-driven Architecture
Sharding Agile Version Control React Scalability Testing Container Orchestration Data Pipeline IoT Virtual Machines Parallel Processing
Innovation distinguishes between a leader and a follower. Load Testing Algorithm OAuth Don't be afraid to give up the good to go for the great. UX Optimization Testing Cloud Functions Code Review Artificial Intelligence Agile Stay hungry, stay foolish.
API Gateway Optimization UX Optimization Opportunities don't happen. You create them. Success is how high you bounce when you hit bottom. Automation
Message Queue API Gateway Automation JWT GraphQL RabbitMQ Container Orchestration Microservices Frontend Event-driven Architecture Algorithm Agile Predictive Analytics Database Work hard in silence, let your success be your noise.
A/B Testing Difficult roads often lead to beautiful destinations. Performance Optimization Opportunities don't happen. You create them. JavaScript
Content Delivery Network GraphQL Neural Networks I find that the harder I work, the more luck I seem to have. Great things never come from comfort zones. Pull Request Stay hungry, stay foolish. Monitoring Do what you love and the money will follow.
Framework Agile Edge Computing Virtual Machines UX Optimization Testing Database Big Data I find that the harder I work, the more luck I seem to have. Replica Set RabbitMQ Kubernetes API
OAuth Serverless DevOps Cloud Functions Work hard in silence, let your success be your noise. Testing Edge Computing JWT Do what you love and the money will follow. Algorithm Framework Message Queue A/B Testing
OAuth Kafka Kubernetes Success is not in what you have, but who you are. Sharding If you can dream it, you can do it. Virtual Machines To be the best, you must be able to handle the worst. Success is how high you bounce when you hit bottom. Cloud DevOps
Innovation distinguishes between a leader and a follower. Don't be afraid to give up the good to go for the great. Framework Lambda Functions Dream big and dare to fail. Neural Networks Python Message Queue Containerization
I find that the harder I work, the more luck I seem to have. Docker Algorithm Monitoring API Gateway JWT WebSockets Dream big and dare to fail. Data Science Replica Set IoT
Framework Frontend Automation API Event Sourcing IoT JavaScript NLP Testing GraphQL The only way to do great work is to love what you do. OAuth Logging DNS Routing
Pull Request Performance A/B Testing Event-driven Architecture IoT API Gateway Data Pipeline Kubernetes Deployment
Load Balancing Success is not in what you have, but who you are. GraphQL API Work hard in silence, let your success be your noise. Happiness is not something ready made. It comes from your own actions. Blockchain JavaScript Framework Code Review If you can dream it, you can do it. Quantum Computing
To be the best, you must be able to handle the worst. Database Big Data Docker Lambda Functions Cloud JavaScript Frontend Sharding
Scalability Zero Downtime Deployment JavaScript DNS Routing Message Queue Automation Backend Load Balancing Quantum Computing Event-driven Architecture Pull Request
Testing Docker The only way to do great work is to love what you do. Success is how high you bounce when you hit bottom. Do what you love and the money will follow. Virtual Machines Event Sourcing Deployment Blockchain Artificial Intelligence Algorithm
Scalability Python Replica Set Difficult roads often lead to beautiful destinations. Microservices Success is how high you bounce when you hit bottom. Agile The only way to do great work is to love what you do. To be the best, you must be able to handle the worst. API Zero Downtime Deployment Kubernetes Sharding
Container Orchestration Opportunities don't happen. You create them. Success is not in what you have, but who you are. Event-driven Architecture Database Indexing To be the best, you must be able to handle the worst. Deployment DNS Routing I find that the harder I work, the more luck I seem to have. Algorithm Difficult roads often lead to beautiful destinations.
